[
  {
    "document_type": "invoice",
    "vendor_name": "Pulau Ketel Sdn Bhd",
    "vendor_sst_id": "W10-2001-220004",
    "invoice_number": "INV-2026-040",
    "invoice_date": "2026-10-02",
    "po_reference": "PO-PA-26-0002",
    "line_items": [
      {
        "description": "Big canvas / Canvas bag",
        "quantity": 30,
        "unit_price": 10.0,
        "tax_amount": 0.0,
        "tax_rate": null
      },
      {
        "description": "Stiker label / Label sticker",
        "quantity": 5,
        "unit_price": 5.0,
        "tax_amount": 0.0,
        "tax_rate": null
      }
    ],
    "subtotal": 400.0,
    "total_tax": 40.0,
    "grand_total": 45.7,
    "currency": "MYR",
    "source_ref": "invoice_001.png",
    "confidence": {
      "vendor_name": 0.95,
      "invoice_number": 0.95,
      "invoice_date": 0.9,
      "po_reference": 0.9,
      "line_items": 0.9,
      "grand_total": 0.95,
      "total_tax": 0.9
    },
    "status": "flagged",
    "flags": [
      "wrong_total",
      "invalid_sst_rate"
    ]
  },
  {
    "document_type": "invoice",
    "vendor_name": "Minuma Supply",
    "vendor_sst_id": "J11-1332-220009-0",
    "invoice_number": "INV-2026-029",
    "invoice_date": "2026-10-05",
    "po_reference": "PO-MG-1010",
    "line_items": [
      {
        "description": "Kertas A4 / A4 paper",
        "quantity": 10,
        "unit_price": 22.0,
        "tax_amount": 13.2,
        "tax_rate": 6
      },
      {
        "description": "Pen hitam / Black pen",
        "quantity": 20,
        "unit_price": 4.5,
        "tax_amount": 5.4,
        "tax_rate": 6
      },
      {
        "description": "Metal clamp",
        "quantity": 25,
        "unit_price": 2.0,
        "tax_amount": 3.0,
        "tax_rate": 6
      }
    ],
    "subtotal": 405.0,
    "total_tax": 21.6,
    "grand_total": 665.5,
    "currency": "MYR",
    "source_ref": "invoice_002.png",
    "confidence": {
      "vendor_name": 0.95,
      "invoice_number": 0.95,
      "invoice_date": 0.9,
      "po_reference": 0.9,
      "line_items": 0.92,
      "grand_total": 0.95,
      "total_tax": 0.92
    },
    "status": "clean",
    "flags": []
  },
  {
    "document_type": "invoice",
    "vendor_name": "Syarikat Makmal Sdn Bhd",
    "vendor_sst_id": "W10-0890-220011-0",
    "invoice_number": "INV-2026-026",
    "invoice_date": "2026-10-07",
    "po_reference": null,
    "line_items": [
      {
        "description": "Tudung kismis / Raisin bread",
        "quantity": 10,
        "unit_price": 7.5,
        "tax_amount": 6.0,
        "tax_rate": 8
      },
      {
        "description": "Sabun pencuci / Washing soap",
        "quantity": 10,
        "unit_price": 9.0,
        "tax_amount": 0.0,
        "tax_rate": 0
      }
    ],
    "subtotal": 675.0,
    "total_tax": 7.0,
    "grand_total": 957.0,
    "currency": "MYR",
    "source_ref": "invoice_003.png",
    "confidence": {
      "vendor_name": 0.95,
      "invoice_number": 0.95,
      "invoice_date": 0.9,
      "po_reference": 0.0,
      "line_items": 0.9,
      "grand_total": 0.95,
      "total_tax": 0.85
    },
    "status": "flagged",
    "flags": [
      "no_po_reference",
      "escalate_missing_po"
    ]
  },
  {
    "document_type": "invoice",
    "vendor_name": "Minuma Office Supplies Sdn Bhd",
    "vendor_sst_id": "J11-1332-220009-0",
    "invoice_number": "INV-2026-018",
    "invoice_date": "2026-09-12",
    "po_reference": "PO-SJ-1010",
    "line_items": [
      {
        "description": "Binder clip",
        "quantity": 30,
        "unit_price": 3.3,
        "tax_amount": 5.94,
        "tax_rate": 6
      },
      {
        "description": "Stapler heavy duty",
        "quantity": 1,
        "unit_price": 1.0,
        "tax_amount": 0.06,
        "tax_rate": 6
      }
    ],
    "subtotal": 522.0,
    "total_tax": 3.0,
    "grand_total": 585.2,
    "currency": "MYR",
    "source_ref": "invoice_004.png",
    "confidence": {
      "vendor_name": 0.95,
      "invoice_number": 0.95,
      "invoice_date": 0.9,
      "po_reference": 0.9,
      "line_items": 0.9,
      "grand_total": 0.95,
      "total_tax": 0.9
    },
    "status": "clean",
    "flags": []
  },
  {
    "document_type": "invoice",
    "vendor_name": "Sri Jaya Trading Sdn Bhd",
    "vendor_sst_id": "W10-2001-220005-0",
    "invoice_number": "INV-2026-012",
    "invoice_date": "2026-09-14",
    "po_reference": "PO-SJ-1122",
    "line_items": [
      {
        "description": "Gunting / Scissors",
        "quantity": 1,
        "unit_price": 0.8,
        "tax_amount": 0.05,
        "tax_rate": 6
      },
      {
        "description": "Pen ballpoint / Ballpoint pen",
        "quantity": 10,
        "unit_price": 0.5,
        "tax_amount": 0.3,
        "tax_rate": 6
      }
    ],
    "subtotal": 52.0,
    "total_tax": 1.0,
    "grand_total": 80.0,
    "currency": "MYR",
    "source_ref": "invoice_005.png",
    "confidence": {
      "vendor_name": 0.95,
      "invoice_number": 0.95,
      "invoice_date": 0.9,
      "po_reference": 0.9,
      "line_items": 0.9,
      "grand_total": 0.95,
      "total_tax": 0.9
    },
    "status": "clean",
    "flags": []
  },
  {
    "document_type": "invoice",
    "vendor_name": "Tulus Logistik Sdn Bhd",
    "vendor_sst_id": "W10-2001-220006-0",
    "invoice_number": "INV-2026-014",
    "invoice_date": "2026-09-12",
    "po_reference": "PO-TL-1009",
    "line_items": [
      {
        "description": "Kotak kadbod / Cardboard box",
        "quantity": 10,
        "unit_price": 1.8,
        "tax_amount": 1.08,
        "tax_rate": 6
      },
      {
        "description": "Stretch wrap film",
        "quantity": 10,
        "unit_price": 3.1,
        "tax_amount": 1.86,
        "tax_rate": 6
      }
    ],
    "subtotal": 400.0,
    "total_tax": 3.0,
    "grand_total": 445.5,
    "currency": "MYR",
    "source_ref": "invoice_006.png",
    "confidence": {
      "vendor_name": 0.95,
      "invoice_number": 0.95,
      "invoice_date": 0.9,
      "po_reference": 0.9,
      "line_items": 0.9,
      "grand_total": 0.95,
      "total_tax": 0.9
    },
    "status": "clean",
    "flags": []
  },
  {
    "document_type": "invoice",
    "vendor_name": "Kedai Tanda Maju Mulia Sdn Bhd",
    "vendor_sst_id": "C10-7732-220010-0",
    "invoice_number": "INV-2026-025",
    "invoice_date": "2026-09-15",
    "po_reference": null,
    "line_items": [
      {
        "description": "Whiteboard",
        "quantity": 10,
        "unit_price": 4.0,
        "tax_amount": 2.4,
        "tax_rate": 6
      },
      {
        "description": "Buku log / Log book",
        "quantity": 5,
        "unit_price": 2.0,
        "tax_amount": 0.6,
        "tax_rate": 6
      },
      {
        "description": "Borang permohonan / Form",
        "quantity": 10,
        "unit_price": 0.5,
        "tax_amount": 0.3,
        "tax_rate": 6
      }
    ],
    "subtotal": 1080.0,
    "total_tax": 1.0,
    "grand_total": 1111.0,
    "currency": "MYR",
    "source_ref": "invoice_007.png",
    "confidence": {
      "vendor_name": 0.92,
      "invoice_number": 0.95,
      "invoice_date": 0.9,
      "po_reference": 0.0,
      "line_items": 0.88,
      "grand_total": 0.95,
      "total_tax": 0.85
    },
    "status": "flagged",
    "flags": [
      "no_po_reference",
      "escalate_missing_po"
    ]
  },
  {
    "document_type": "invoice",
    "vendor_name": "Fast Courier Sdn Bhd",
    "invoice_number": "INV-2026-019",
    "invoice_date": "2026-09-20",
    "po_reference": "PO-FC-4040",
    "line_items": [
      {
        "description": "Penghantaran dokumen / Document delivery",
        "quantity": 10,
        "unit_price": 10.0,
        "tax_amount": 6.0,
        "tax_rate": 6
      },
      {
        "description": "Penghantaran pakej / Package delivery",
        "quantity": 5,
        "unit_price": 8.0,
        "tax_amount": 2.4,
        "tax_rate": 6
      }
    ],
    "subtotal": 720.0,
    "total_tax": 18.0,
    "grand_total": 808.5,
    "currency": "MYR",
    "source_ref": "invoice_008.png",
    "confidence": {
      "vendor_name": 0.95,
      "invoice_number": 0.95,
      "invoice_date": 0.9,
      "po_reference": 0.9,
      "line_items": 0.9,
      "grand_total": 0.95,
      "total_tax": 0.9
    },
    "status": "clean",
    "flags": []
  },
  {
    "document_type": "invoice",
    "vendor_name": "Car Wipers Sdn Bhd",
    "vendor_sst_id": "C10-7732-220012-0",
    "invoice_number": "INV-2026-022",
    "invoice_date": "2026-10-03",
    "po_reference": null,
    "line_items": [
      {
        "description": "Car wipers / Wiper blades",
        "quantity": 10,
        "unit_price": 75.0,
        "tax_amount": 45.0,
        "tax_rate": 6
      },
      {
        "description": "Busa calit / Foam sponge",
        "quantity": 20,
        "unit_price": 9.0,
        "tax_amount": 10.8,
        "tax_rate": 6
      }
    ],
    "subtotal": 1395.0,
    "total_tax": 15.0,
    "grand_total": 1534.5,
    "currency": "MYR",
    "source_ref": "invoice_009.png",
    "confidence": {
      "vendor_name": 0.95,
      "invoice_number": 0.95,
      "invoice_date": 0.9,
      "po_reference": 0.0,
      "line_items": 0.9,
      "grand_total": 0.95,
      "total_tax": 0.9
    },
    "status": "flagged",
    "flags": [
      "no_po_reference",
      "escalate_missing_po"
    ]
  },
  {
    "document_type": "invoice",
    "vendor_name": "Sistem Komputer MT Sdn Bhd",
    "vendor_sst_id": "P10-2001-220015-0",
    "invoice_number": "INV-2026-023",
    "invoice_date": "2026-09-14",
    "po_reference": "PO-SK-0303",
    "line_items": [
      {